index,url,valid,domain,title,description,image,published,archive,content,quote,language,keyword
https://freerepublic.com/focus/f-chat/4290792/posts,https://freerepublic.com/focus/f-chat/4290792/posts,0,freerepublic.com,Iceland’s Second Biggest Volcano on Brink of Eruption: Europe Travel Disruption Feared,"Baroarbunga, one of the largest volcanoes in the whole of Iceland, has seen 130 earthquakes shatter its surrounding surfaces in just five hours, leading many to feel a full scale eruption will force flights to be severely disrupted. Iceland has been the unfor…",,2025-01-17T22:58:49Z,,"Skip to comments.
Icelands Second Biggest Volcano on Brink of Eruption: Europe Travel Disruption FearedEuroweekly News ^
 | 17 Jan 2025
 | Connor Morpurgo
Posted on 01/17/2025 2:58:49 PM PST by n… [+4461 chars]",,en,'volcano'
https://freerepublic.com/focus/f-chat/4290859/posts,https://freerepublic.com/focus/f-chat/4290859/posts,0,freerepublic.com,Mount Shasta rangers rescue 'particularly unprepared' climber — a goose,"Every year, thousands of climbers test their skills on Mount Shasta, California’s fifth-highest peak and the second-highest volcano in the Cascade Range. In 2023, around 5,000 to 6,000 people attempted the roughly 14,180-foot climb to the summit, with about h…",,2025-01-18T08:47:52Z,,"Skip to comments.
Mount Shasta rangers rescue 'particularly unprepared' climber a gooseSan Francisco Chronicle / SFGate.com ^
 | Updated Jan 14, 2025 12:14 p.m.
 | By Matt LaFever, North Coast Con… [+2185 chars]",,en,'volcano rescue'
https://www.digitaljournal.com/world/indonesias-mount-ibu-erupts-more-than-1000-times-this-month/article,https://www.digitaljournal.com/world/indonesias-mount-ibu-erupts-more-than-1000-times-this-month/article,0,www.digitaljournal.com,"Indonesia’s Mount Ibu erupts more than 1,000 times this month","A volcano in eastern Indonesia has erupted at least a thousand times this month, according to an official report Sunday as efforts were underway to evacuate thousands of villagers living near the rumbling mountain. Mount Ibu, on the remote island of Halmahera…",https://www.digitaljournal.com/wp-content/uploads/2025/01/3db28624fcf805d2a5e931dcca506f895dd5ecb9-1.jpg,2025-01-19T08:07:20Z,,"Mount Ibu, on the Indonesian island of Halmahera, has erupted more than a thousand times this month - Copyright AFP/File AZZAM
A volcano in eastern Indonesia has erupted at least a thousand times th… [+2512 chars]",,en,'volcano erupt'
https://www.ibtimes.com/indonesias-mount-ibu-erupts-more-1000-times-this-month-3759942,https://www.ibtimes.com/indonesias-mount-ibu-erupts-more-1000-times-this-month-3759942,0,www.ibtimes.com,"Indonesia's Mount Ibu Erupts More Than 1,000 Times This Month","A volcano in eastern Indonesia has erupted at least a thousand times this month, according to an official report Sunday as efforts were underway to evacuate thousands of villagers living near the rumbling mountain.",https://d.ibtimes.com/en/full/4576476/mount-ibu-indonesian-island-halmahera-has-erupted-more-thousand-times-this-month.jpg,2025-01-19T08:12:07Z,,"A volcano in eastern Indonesia has erupted at least a thousand times this month, according to an official report Sunday as efforts were underway to evacuate thousands of villagers living near the rum… [+2383 chars]",,en,'volcano'
https://www.hurriyetdailynews.com/mount-ibu-erupts-more-than-1-000-times-this-month-204841,https://www.hurriyetdailynews.com/mount-ibu-erupts-more-than-1-000-times-this-month-204841,0,www.hurriyetdailynews.com,"Mount Ibu erupts more than 1,000 times this month","A volcano in eastern Indonesia has erupted at least a thousand times this month, according to an official report on Sunday as efforts were underway to evacuate thousands of villagers living near the rumbling mountain.",https://image.hurimg.com/i/hurriyet/75/200x200/678cc082405c0fd564768048.jpg,2025-01-19T09:06:12Z,,"JAKARTA
A volcano in eastern Indonesia has erupted at least a thousand times this month, according to an official report on Sunday as efforts were underway to evacuate thousands of villagers living … [+1282 chars]",,en,'volcano'
https://phys.org/news/2025-01-indonesia-mount-ibu-erupts-month.html,https://phys.org/news/2025-01-indonesia-mount-ibu-erupts-month.html,0,phys.org,"Indonesia's Mount Ibu erupts more than 1,000 times this month","A volcano in eastern Indonesia has erupted at least a thousand times this month, according to an official report Sunday as efforts were underway to evacuate thousands of villagers living near the rumbling mountain.",https://scx2.b-cdn.net/gfx/news/2025/mount-ibu-on-the-indon.jpg,2025-01-19T10:21:17Z,,"A volcano in eastern Indonesia has erupted at least a thousand times this month, according to an official report Sunday as efforts were underway to evacuate thousands of villagers living near the rum… [+2818 chars]",,en,'volcano'
https://www.voanews.com/a/indonesia-s-mount-ibu-erupts-more-than-1-000-times-this-month-/7942866.html,https://www.voanews.com/a/indonesia-s-mount-ibu-erupts-more-than-1-000-times-this-month-/7942866.html,0,www.voanews.com,"Indonesia's Mount Ibu erupts more than 1,000 times this month","Ternate, Indonesia — A volcano in eastern Indonesia has erupted at least a thousand times this month, according to an official report Sunday as efforts were underway to evacuate thousands of villagers living near the rumbling mountain.


Mount Ibu, on the rem…",https://gdb.voanews.com/6C2B1621-697C-447F-B655-DD78204B32A5.jpg,2025-01-20T00:31:11Z,,"Ternate, Indonesia  A volcano in eastern Indonesia has erupted at least a thousand times this month, according to an official report Sunday as efforts were underway to evacuate thousands of villagers… [+2396 chars]",,en,'volcano'
https://theconversation.com/ethiopian-earthquakes-and-volcanic-eruptions-earth-scientist-explains-the-link-247245,https://theconversation.com/ethiopian-earthquakes-and-volcanic-eruptions-earth-scientist-explains-the-link-247245,0,theconversation.com,Ethiopian earthquakes and volcanic eruptions: earth scientist explains the link,Volcanoes and earthquakes are both natural phenomena driven by the dynamic processes that shape Earth’s interior and surface.,https://images.theconversation.com/files/641980/original/file-20250113-19-u1ja7e.jpg?ixlib=rb-4.1.0&rect=0%2C451%2C4459%2C2229&q=45&auto=format&w=1356&h=668&fit=crop,2025-01-20T10:14:31Z,,"Residents ride a tuk-tuk taxi along a road damaged by multiple earthquakes near the town of Kabanna in the north of Ethiopia. Amanuel Sileshi/AFP via Getty Images
Ethiopia’s Afar and Oromia regions … [+7291 chars]",,en,'volcano'
https://biztoc.com/x/84a59068af6cb5cf,https://biztoc.com/x/84a59068af6cb5cf,0,biztoc.com,Kilauea: Hawaii Volcano Erupts Again Spewing Toxic Gases and Volcanic Smog,"Hawaii's Kīlauea volcano has entered its fifth eruptive episode since late December 2024, resuming activity at 2:57 p.m. HST (7:57 p.m. ET) on January 22, 2025.
Fountains of lava between 16 and 33 feet high have been observed, accompanied by a short lava flow…",https://biztoc.com/cdn/84a59068af6cb5cf_s.webp,2025-01-23T13:47:12Z,,"Hawaii's Klauea volcano has entered its fifth eruptive episode since late December 2024, resuming activity at 2:57 p.m. HST (7:57 p.m. ET) on January 22, 2025.Fountains of lava between 16 and 33 feet… [+141 chars]",,en,'lava volcano'
https://www.wbur.org/onpoint/2025/01/23/volcanologist-tamsin-mather-adventures-in-volcanoland,https://www.wbur.org/onpoint/2025/01/23/volcanologist-tamsin-mather-adventures-in-volcanoland,0,www.wbur.org,Volcanologist Tamsin Mather on her 'adventures in volcanoland',"What's it like standing on the slopes of an active, erupting volcano? Volcanologist Tamsin Mather takes us on her journey to some of the world's biggest volcanoes.",https://wordpress.wbur.org/wp-content/uploads/2025/01/Hawaii_Volcano_24359788187180-1000x667.jpg,2025-01-23T19:00:37Z,,"What's it like standing on the slopes of an active, erupting volcano? Volcanologist Tamsin Mather takes us on her journey to some of the world's biggest volcanoes.
Guest
Tamsin Mather, volcanologis… [+43139 chars]",,en,'volcano death'
http://twistedsifter.com/2025/01/scientists-exploring-deep-sea-volcanoes-discover-life-that-exists-beyond-the-limits-we-ever-thought-possible/,http://twistedsifter.com/2025/01/scientists-exploring-deep-sea-volcanoes-discover-life-that-exists-beyond-the-limits-we-ever-thought-possible/,0,twistedsifter.com,Scientists Exploring Deep Sea Volcanoes Discover Life That Exists Beyond The Limits We Ever Thought Possible,"With so much more ocean to explore, the real question is: what else is out there?",https://twistedsifter.com/wp-content/uploads/2025/01/Sea-Floor.jpg,2025-01-24T14:49:03Z,,"A team of scientists exploring an underwater volcano have discovered that life below the seafloor is more thriving than we could have ever imagined.
In a new article published in the scientific jour… [+5359 chars]",,en,'volcano damage'
https://www.naturalnews.com/2025-01-27-underwater-volcano-off-oregon-coast-erupt-2025.html,https://www.naturalnews.com/2025-01-27-underwater-volcano-off-oregon-coast-erupt-2025.html,0,www.naturalnews.com,"Underwater volcano off Oregon Coast could erupt by 2025, scientists warn","Axial Seamount, a 3,600-foot-tall underwater volcano located 300 miles off Oregon’s coast, is showing signs of an impending eruption, with a forecast window between July 2024 and the end of 2025. Axial Seamount is one of the most monitored underwater volcanoe…",https://www.naturalnews.com/wp-content/uploads/sites/91/2025/01/Underwater-Coral-Reef-Ocean.jpg,2025-01-27T06:00:00Z,,"<ul><li>Axial Seamount, a 3,600-foot-tall underwater volcano located 300 miles off Oregon's coast, is showing signs of an impending eruption, with a forecast window between July 2024 and the end of 2… [+6544 chars]",,en,'volcano'
https://bringatrailer.com/listing/2022-porsche-panamera-gts-4/,https://bringatrailer.com/listing/2022-porsche-panamera-gts-4/,0,bringatrailer.com,2022 Porsche Panamera GTS Sport Turismo,"This 2022 Porsche Panamera GTS Sport Turismo is finished in Volcano Gray Metallic over Bordeaux Red leather and was ordered with the Assistance, Premium, and Sport Chrono packages. It is powered by a twin-turbocharged 4.0-liter V8 that drives all four wheels …",https://bringatrailer.com/wp-content/uploads/2025/01/2022_porsche_panamera-gts_ai3a9201-low-res-30068.jpg,2025-01-28T00:33:35Z,,"This 2022 Porsche Panamera GTS Sport Turismo is finished in Volcano Gray Metallic over Bordeaux Red leather and was ordered with the Assistance, Premium, and Sport Chrono packages. It is powered by a… [+2697 chars]",,en,'volcano'
https://www.sciencealert.com/the-most-active-volcano-in-the-northeast-pacific-is-preparing-to-erupt,https://www.sciencealert.com/the-most-active-volcano-in-the-northeast-pacific-is-preparing-to-erupt,0,www.sciencealert.com,The Most Active Volcano in The Northeast Pacific Is Preparing to Erupt,"Earth bubbles and broils beneath an underwater peak called Axial Seamount, located 480 kilometers (300 miles) off Oregon's coast, causing it to swell in changing patterns that hint at impending strife.",https://www.sciencealert.com/images/2025/01/ExaggeratedTopologyOfAxialSeamount.jpg,2025-01-28T06:30:06Z,,"Earth bubbles and broils beneath an underwater peak called Axial Seamount, located 480 kilometers (300 miles) off Oregon's coast, causing it to swell in changing patterns that hint at impending strif… [+2797 chars]",,en,'volcano erupt'
https://abcnews.go.com/US/wireStory/hawaiis-kilauea-volcano-spewing-lava-118172318,https://abcnews.go.com/US/wireStory/hawaiis-kilauea-volcano-spewing-lava-118172318,0,abcnews.go.com,Hawaii's Kilauea volcano is spewing lava once again,One of the world’s most active volcanoes is back in action,https://i.abcnewsfe.com/a/f4d6f422-56e3-4680-949d-f0d393abbfa1/wirestory_6fe97d32e171ab7d916ce31a2225f386_16x9.jpg?w=1600,2025-01-28T12:46:23Z,,"HONOLULU -- One of the worlds most active volcanoes is back in action.
The Kilauea volcano at Hawaii Volcanoes National Park is spewing lava once again, the seventh recorded episode in recent weeks.… [+968 chars]",,en,'lava volcano'
https://timesofindia.indiatimes.com/world/us/hawaiis-kilauea-volcano-is-spewing-lava-once-again/articleshow/117637791.cms,https://timesofindia.indiatimes.com/world/us/hawaiis-kilauea-volcano-is-spewing-lava-once-again/articleshow/117637791.cms,0,timesofindia.indiatimes.com,Hawaii's Kilauea volcano is spewing lava once again,"Kilauea volcano in Hawaii has resumed erupting at Hawaii Volcanoes National Park, marking the seventh eruption in recent weeks. After brief pauses, the eruption began on December 23 and resumed on Monday, with spatter fountains reaching heights of 100 to 120 …","https://static.toiimg.com/thumb/msid-117638074,width-1070,height-580,imgsize-1709681,resizemode-75,overlay-toi_sw,pt-32,y_pad-40/photo.jpg",2025-01-28T12:54:09Z,,10 most beautiful sea animals,,en,'volcano erupt'
https://www.popsci.com/science/dormant-volcanoes-magma/,https://www.popsci.com/science/dormant-volcanoes-magma/,0,www.popsci.com,Magma chambers found lurking in dormant volcanoes,"Though immensely powerful, volcanoes are not always spewing hot lava around. Many are considered dormant or even extinct and have not shown their strength for hundreds of thousands of years in some cases. However, a team of scientists recently found magma cha…",https://www.popsci.com/wp-content/uploads/2025/01/crater-lake-volcano.jpg,2025-01-28T18:16:28Z,,"Though immensely powerful, volcanoes are not always spewing hot lava around. Many are considered dormant or even extinct and have not shown their strength for hundreds of thousands of years in some c… [+4703 chars]",,en,'volcano'
https://www.bostonherald.com/2025/01/28/hawaii-kilauea-volcano/,https://www.bostonherald.com/2025/01/28/hawaii-kilauea-volcano/,0,www.bostonherald.com,Hawaii’s Kilauea volcano is spewing lava once again,One of the world’s most active volcanoes is back in action.,https://www.bostonherald.com/wp-content/uploads/2025/01/AP25028447459516.jpg?w=1024&h=683,2025-01-28T18:45:05Z,,"HONOLULU (AP) — One of the world’s most active volcanoes is back in action.
The Kilauea volcano at Hawaii Volcanoes National Park is spewing lava once again, the seventh recorded episode in recent w… [+1028 chars]",,en,'lava volcano'
https://nypost.com/2025/01/28/science/eruption-imminent-for-mile-wide-hidden-volcano-near-us-coast/,https://nypost.com/2025/01/28/science/eruption-imminent-for-mile-wide-hidden-volcano-near-us-coast/,0,nypost.com,Eruption ‘imminent’ for mile-wide hidden volcano near US coast: ‘Final stages of buildup’,"""The eruptions are pretty big,"" said a volcanologist at Oregon State University.",https://nypost.com/wp-content/uploads/sites/2/2025/01/off-oregons-coast-causing-swell-97501513.jpg?quality=75&strip=all&w=1024,2025-01-28T18:55:45Z,,"Will the coast be toast?
An increase in seismic activity has prompted predictions that a mile-wide submarine volcano named the Axial Seamount will erupt near the United States West Coast by year’s e… [+3072 chars]",,en,'volcano erupt'
https://nypost.com/2025/01/28/us-news/scientists-warn-of-toxic-gas-volcanic-glass-as-hawaiis-kilauea-begins-7th-eruptive-episode/,https://nypost.com/2025/01/28/us-news/scientists-warn-of-toxic-gas-volcanic-glass-as-hawaiis-kilauea-begins-7th-eruptive-episode/,0,nypost.com,"Scientists warn of toxic gas, volcanic glass as Hawaii’s Kilauea begins 7th eruptive episode","The world’s most active volcano is at it again after Hawaii’s Kilauea began its seventh episode of its ongoing eruption, with video showing lava shooting more than 100 feet into the air.",https://nypost.com/wp-content/uploads/sites/2/2025/01/newspress-collage-5fqqhr4nd-1738088817510.jpg?quality=75&strip=all&1738070902&w=1024,2025-01-28T19:15:51Z,,"HAWAII VOLCANOES NATIONAL PARK The worlds most active volcano is at it again after Hawaiis Kilauea began its seventh episode of its ongoing eruption, with video showing lava shooting more than 100 fe… [+1935 chars]",,en,'lava volcano'
https://pubs.rsc.org/en/content/articlelanding/2025/dt/d4dt02912g,https://pubs.rsc.org/en/content/articlelanding/2025/dt/d4dt02912g,0,pubs.rsc.org,Optimized Ni(II)-doping in Co(III)-based layered double hydroxides towards electrochemical oxygen evolution catalysis,"Dalton Trans., 2025, Advance ArticleDOI: 10.1039/D4DT02912G, PaperHuiling Si, Yanhong Ma, Hang Zu, Jianbo LiangNi(II)-doped Co(III)-based LDHs show volcano-like OER activity from a synergy between Ni and Co cations. The best performance exceeds that of Ni(II)…",https://pubs.rsc.org/en/Content/Image/GA/D4DT02912G,2025-01-30T00:00:00Z,,"H. Si, Y. Ma, H. Zu and J. Liang,
 Dalton Trans., 2025, Advance Article
, DOI: 10.1039/D4DT02912G
To request permission to reproduce material from this article, please go to the 
 Copyright Clear… [+592 chars]",,en,'volcano activity'
https://allthatsinteresting.com/mount-vesuvius-brain-matter,https://allthatsinteresting.com/mount-vesuvius-brain-matter,0,allthatsinteresting.com,The Mount Vesuvius Eruption Was So Hot That It Turned One Man’s Brain To ‘Glass’,"When the volcano erupted in 79 A.D., it baked hundreds of people to death — and transformed at least one victim's brain matter into twisted, glassy fragments.
The post The Mount Vesuvius Eruption Was So Hot That It Turned One Man’s Brain To ‘Glass’ appeared f…",https://allthatsinteresting.com/wordpress/wp-content/uploads/2020/01/glass-brain.png,2025-01-30T17:00:10Z,,"The New England Journal of Medicine 2019Glassy black brain material extracted from the destroyed skull of a Vesuvius victim.
In previous research, scientists discovered that victims of Mount Vesuviu… [+4351 chars]",,en,'volcano'
https://freerepublic.com/focus/f-chat/4293705/posts,https://freerepublic.com/focus/f-chat/4293705/posts,0,freerepublic.com,Scientists Find Something Totally Unexpected Hidden Under Six North American Volcanoes,Scientists studying six North American volcanoes situated along the continent’s Cascade Range have found active magma underneath both active and dormant volcanic sites. Previous research has suggested that volcanoes lose significant magma volume when they eru…,,2025-01-30T17:22:00Z,,"Skip to comments.
Scientists Find Something Totally Unexpected Hidden Under Six North American Volcanoes
The Debrief ^
 | January 30, 2025
 | Christopher Plain
Posted on 01/30/2025 9:22:00 AM PS… [+7364 chars]",,en,'volcano'
