index,published,keyword,domain,language,valid,title,description,url,image,archive,content,quote,de,en,la,added
b5d34f5e1063dc9822b60d4c9a5fd309,2025-12-04T16:00:00Z,'volcanic spewing',www.livescience.com,en,0.3,"Volcanic eruption triggered 'butterfly effect' that led to the Black Death, researchers find",A volcanic eruption in 1345 may have kicked off a series of events that led to the Black Death sweeping through medieval Europe.,https://www.livescience.com/planet-earth/volcanic-eruption-triggered-butterfly-effect-that-led-to-the-black-death-researchers-find,https://cdn.mos.cms.futurecdn.net/Cr9HwbuLVMnt7YYZaTbA6R-2276-80.png,http://web.archive.org/web/20251204213839/https://www.livescience.com/planet-earth/volcanic-eruption-triggered-butterfly-effect-that-led-to-the-black-death-researchers-find,"An unknown volcanic eruption in the mid-14th century may have set the stage for the spread of the Black Death
 in Europe, according to a new study. By triggering a cool and overcast period in the Me… [+4597 chars]",,"Forscher fanden heraus, dass der Vulkanausbruch einen „Schmetterlingseffekt“ auslöste, der zum Schwarzen Tod führte. Ein Vulkanausbruch im Jahr 1345 könnte eine Reihe von Ereignissen ausgelöst haben, die dazu führten, dass der Schwarze Tod über das mittelalterliche Europa fegte.","Volcanic eruption triggered 'butterfly effect' that led to the Black Death, researchers find. A volcanic eruption in 1345 may have kicked off a series of events that led to the Black Death sweeping through medieval Europe.","Volcanica eruptio utitur 'papilio effectum', quod ad mortem Nigrum duxit, investigatores inveniunt. Volcanica eruptio anno 1345 recalcitrare potest seriem eventuum qui ad mortem Niger per Europam mediaevalem rapiente ducti sunt.",2025-12-25 06:37:49+00:00
4c63f40137c4890efc121c0f519e48fb,2025-12-04T16:00:33Z,'volcanic spewing',www.sciencealert.com,en,0.3,Black Death's Carnage Traced to a Volcanic Eruption Half a World Away,A major volcanic cataclysm may have been ultimately responsible for the spread of the Black Death across Europe in the 1340s.,https://www.sciencealert.com/black-deaths-carnage-traced-to-a-volcanic-eruption-half-a-world-away,https://www.sciencealert.com/images/2025/12/volacno.jpg,,"A major volcanic cataclysm may have been ultimately responsible for the spread of the Black Death across Europe in the 1340s.
In a lovely example of scientific investigation at its best, researchers… [+5935 chars]",,Das Blutbad des Schwarzen Todes lässt sich auf einen Vulkanausbruch in einer halben Weltentfernung zurückführen. Eine große Vulkankatastrophe könnte letztendlich für die Ausbreitung des Schwarzen Todes in Europa in den 1340er Jahren verantwortlich gewesen sein.,Black Death's Carnage Traced to a Volcanic Eruption Half a World Away. A major volcanic cataclysm may have been ultimately responsible for the spread of the Black Death across Europe in the 1340s.,Mors atra caedes ad Volcanum Eruptio Medium Mundus Recedite. Maior cataclysmus volcanicus potest ultimo responsabilis esse dilatationem Black Mors trans Europam in 1340s.,2025-12-25 06:37:49+00:00
328f752739aed5f8b1f06109bc6f5f40,2025-12-04T16:05:00Z,'volcanic spewing',www.discovermagazine.com,en,0.3,Volcanic Eruptions May Have Been Responsible for the Spread of Black Death in Medieval Europe,Learn how volcanic eruptions in 1345 started a chain of events that allowed the plague to enter Europe and start the Black Death.,https://www.discovermagazine.com/volcanic-eruptions-may-have-been-responsible-for-the-spread-of-black-death-in-medieval-europe-48347,https://cdn.discovermagazine.com/assets/image/57957/black-death-volcano-x.jpg,,"Before the Black Death claimed millions of lives across medieval Europe, its arrival on the continent may have been propelled by volcanic eruptions. These eruptions likely brought a string of unusual… [+4728 chars]",,"Vulkanausbrüche könnten für die Ausbreitung des Schwarzen Todes im mittelalterlichen Europa verantwortlich gewesen sein. Erfahren Sie, wie Vulkanausbrüche im Jahr 1345 eine Kette von Ereignissen auslösten, die es der Pest ermöglichten, nach Europa einzudringen und den Schwarzen Tod auszulösen.",Volcanic Eruptions May Have Been Responsible for the Spread of Black Death in Medieval Europe. Learn how volcanic eruptions in 1345 started a chain of events that allowed the plague to enter Europe and start the Black Death.,"Volcanicae eruptiones responsabiles ob expansionem mortis nigrae in Europa mediaevali esse possunt. Disce quomodo eruptiones vulcanicae anno 1345 torquem rerum inceperunt, quae pestem in Europam ingredi permisit et Mortem Nigrum committitur.",2025-12-25 06:37:49+00:00
6fe398fe3f1ee18135758c5050c8fdc2,2025-12-04T16:10:00Z,'volcanic spewing',www.scientificamerican.com,en,0.3,The Black Death May Be Linked to a Mysterious Volcanic Eruption,"The Black Death ravaged Europe, and scientists and historians are still working to understand how it became so deadly",https://www.scientificamerican.com/article/the-black-death-may-be-linked-to-a-mysterious-volcanic-eruption/,https://static.scientificamerican.com/dam/m/215e7efed42db45b/original/GettyImages-932353318-plague_web.jpeg?m=1764861819.07&w=1200,,"The infamous Black Death—a pandemic that killed as many as one third to one half of Europeans within just a few years—may have been aided in its devastation by an unknown volcanic eruption.
That’s t… [+3951 chars]",,"Der Schwarze Tod könnte mit einem mysteriösen Vulkanausbruch verbunden sein. Der Schwarze Tod verwüstete Europa und Wissenschaftler und Historiker arbeiten immer noch daran, zu verstehen, wie er so tödlich wurde","The Black Death May Be Linked to a Mysterious Volcanic Eruption. The Black Death ravaged Europe, and scientists and historians are still working to understand how it became so deadly","Mors Nigra Mysterio Volcanicae Eruptioni iungatur. Mors Niger Europam depopulavit, et docti et historici adhuc laborant ad intellegendum quomodo facta sit tam mortifera",2025-12-25 06:37:49+00:00
a81aff6dce5f02be103cccef2cf8cf51,2025-12-08T17:40:53Z,'volcano death',timesofindia.indiatimes.com,en,0.9,Unknown volcano eruption claimed as cause of Black Death,"A 1345 volcanic eruption likely triggered a climate crisis, causing crop failures and forcing European port cities to open new trade routes with Central Asia. This shift, researchers suggest, inadvertently facilitated the Black Death's arrival in Europe via t…",https://timesofindia.indiatimes.com/world/europe/unknown-volcano-eruption-claimed-as-cause-of-black-death/articleshow/125841685.cms,"https://static.toiimg.com/thumb/msid-125841843,width-1070,height-580,imgsize-803410,resizemode-75,overlay-toi_sw,pt-32,y_pad-500/photo.jpg",,"A 1345 volcanic eruption likely triggered a climate crisis, causing crop failures and forcing European port cities to open new trade routes with Central Asia. This shift, researchers suggest, inadver… [+304 chars]",,"Unbekannter Vulkanausbruch gilt als Ursache für den Schwarzen Tod. Ein Vulkanausbruch im Jahr 1345 löste wahrscheinlich eine Klimakrise aus, die zu Ernteausfällen führte und europäische Hafenstädte dazu zwang, neue Handelsrouten mit Zentralasien zu eröffnen. Diese Verschiebung, so vermuten Forscher, erleichterte unbeabsichtigt die Ankunft des Schwarzen Todes in Europa über …","Unknown volcano eruption claimed as cause of Black Death. A 1345 volcanic eruption likely triggered a climate crisis, causing crop failures and forcing European port cities to open new trade routes with Central Asia. This shift, researchers suggest, inadvertently facilitated the Black Death's arrival in Europe via t…","Ignota eruptio vulcanus causam mortis nigrae petita est. A 1345 eruptio molaris verisimile discrimen climatis urit, causando defectiones segetes et urbes portum Europaeum cogebat ad novas commercia itinera cum Central Asia aperienda. Haec mutatio, investigatores suadeant, imprudenter in Europam adventus mortis nigrae faciliorem esse per t…",2025-12-25 06:37:49+00:00
4bd3fb170b45794d299f77fd1104b217,2025-12-11T17:29:15Z,'volcano tectonic',www.droidgamers.com,en,0.3,How To Complete Line’s Quest In The Forge,"Maybe lead on the 'secret lava cave' rather than the insults next time, Line.
The post How To Complete Line’s Quest In The Forge appeared first on Droid Gamers.",https://www.droidgamers.com/guides/how-to-complete-lines-quest-in-the-forge/,https://www.droidgamers.com/wp-content/uploads/2025/12/how-to-complete-lines-quest-in-the-forge.jpg,,"Who is Line? Why are they so rude? What on earth is Lightite? Is there really a hidden volcano under Ruined Cave? We’re glad you asked, because we’ve got the answers in this guide on how to complete … [+1816 chars]",,"So schließen Sie Lines Quest in der Schmiede ab. Vielleicht führe dich beim nächsten Mal eher auf die „geheime Lavahöhle“ als auf die Beleidigungen, Line.
Der Beitrag „How To Complete Line’s Quest In The Forge“ erschien zuerst auf Droid Gamers.","How To Complete Line’s Quest In The Forge. Maybe lead on the 'secret lava cave' rather than the insults next time, Line.
The post How To Complete Line’s Quest In The Forge appeared first on Droid Gamers.","Quomodo investigationem in Forge complere. Fortasse plumbum in 'lavo secreto speluncae' potius quam contumeliae proximo tempore, Line.
Posta Quomodo Completorium Linearum in The Forge primum apparuit in Droid Gamers.",2025-12-25 18:33:55+00:00
f004a631aca8b1fda030ef5402d82df5,2025-12-20T18:00:00Z,'volcano evacuation',wattsupwiththat.com,en,0.3,Scientific Report or Legal Brief? The Hunga Tonga Assessment and the Anatomy of Narrative Closure,"In that sense, the document reads less like an open scientific inquiry and more like a legal brief. Evidence is marshaled, counterarguments anticipated, uncertainties catalogued, and a verdict delivered early, then defended at length. The goal is not discover…",https://wattsupwiththat.com/2025/12/20/scientific-report-or-legal-brief-the-hunga-tonga-assessment-and-the-anatomy-of-narrative-closure/,https://i0.wp.com/wattsupwiththat.com/wp-content/uploads/2025/12/charlesrotter_A_lawyer_giving_a_closing_argument_hunga-tong-midjourney-plus.webp?fit=1024%2C512&quality=75&ssl=1,,"When the Hunga TongaHunga Haapai volcano erupted in January 2022, it immediately posed a problemnot merely scientific, but institutional. The eruption was the most explosive in the satellite era, inj… [+8260 chars]",,"Wissenschaftlicher Bericht oder juristischer Bericht? Die Hunga Tonga-Bewertung und die Anatomie des narrativen Abschlusses. In diesem Sinne liest sich das Dokument weniger wie eine offene wissenschaftliche Untersuchung, sondern eher wie ein juristischer Brief. Beweise werden gesammelt, Gegenargumente vorweggenommen, Unsicherheiten katalogisiert und ein Urteil frühzeitig gefällt und dann ausführlich verteidigt. Das Ziel ist nicht zu entdecken...","Scientific Report or Legal Brief? The Hunga Tonga Assessment and the Anatomy of Narrative Closure. In that sense, the document reads less like an open scientific inquiry and more like a legal brief. Evidence is marshaled, counterarguments anticipated, uncertainties catalogued, and a verdict delivered early, then defended at length. The goal is not discover…","Scientific Report or Legal Brief? Hunga Tonga Assessionis et Anatomia Narrationis clausurae. In hoc sensu documentum minus legit quasi apertam inquisitionem scientificam et quasi brevem legalem. Evidentia instructa, argumentationes praeventus, incertae scripturae, et sententia mature tradita, demum defensa. Finis non est invenire...",2025-12-26 12:48:16+00:00
eeaa6eb751df75ecd20c24a048e0c099,2025-12-22T19:39:34Z,'volcano',insidethemagic.net,en,0.7,Woman Defecates While Being Interrogated by Police at Universal’s Volcano Bay,"A video shared online documents an unpleasant incident that took place at Volcano Bay in March. Over the years, Universal Orlando Resort has seen no shortage of guest behavior that strays far beyond the expected bounds of a theme park visit. Viral videos, pol…",https://insidethemagic.net/2025/12/woman-interrogation-universal-volcano-bay-cj1/,https://insidethemagic.net/wp-content/uploads/2023/05/Volcano-Bay-Honu-Raft.jpg,,"A video shared online documents an unpleasant incident that took place at Volcano Bay in March.
Over the years, Universal Orlando Resort has seen no shortage of guest behavior that strays far beyond… [+3938 chars]",,"Frau entleert sich, während sie von der Polizei in Universal’s Volcano Bay verhört wird. Ein online veröffentlichtes Video dokumentiert einen unangenehmen Vorfall, der sich im März in Volcano Bay ereignete. Im Laufe der Jahre hat es im Universal Orlando Resort nicht an Gästeverhalten gefehlt, das weit über die erwarteten Grenzen eines Freizeitparkbesuchs hinausgeht. Virale Videos, Pol…","Woman Defecates While Being Interrogated by Police at Universal’s Volcano Bay. A video shared online documents an unpleasant incident that took place at Volcano Bay in March. Over the years, Universal Orlando Resort has seen no shortage of guest behavior that strays far beyond the expected bounds of a theme park visit. Viral videos, pol…","Mulier Defecates, dum interrogatur a Police in Volcano Sinus Universalis. A video communia documenta interretialem incidentia iniucunda quae apud Volcano Bay mense Martio facta sunt. Per annos, Universal Orlando Obstinatus nullam hospitum morum inopiam vidit, qui longe ultra expectata thematis parcum limites vagatur. Virales videos, pol…",2025-12-26 12:48:16+00:00
459b969fb5d3b28b59f47a7d3fb9f46b,2025-12-22T04:42:16Z,'volcano',post.rlsbb.to,en,0.9,Discovered By Disaster S01E09 1080p DSNP WEB-DL H264-Dooky,"Season 1, Episode 09 – “Lost Treasures And Resilient Civilizations”Fish remains found near an angry Sumatran volcano could suggest a new human migration route, and evidence of early Olympic sacrificial rituals are revealed. Visit a prehistoric village smoked …",https://post.rlsbb.to/discovered-by-disaster-s01e09-1080p-dsnp-web-dl-h264-dooky/,,,"Season 1, Episode 09 “Lost Treasures And Resilient Civilizations”Fish remains found near an angry Sumatran volcano could suggest a new human migration route, and evidence of early Olympic sacrificial… [+649 chars]",,"Entdeckt durch die Katastrophe S01E09 1080p DSNP WEB-DL H264-Dooky. Staffel 1, Folge 09 – „Verlorene Schätze und widerstandsfähige Zivilisationen“ Fischreste, die in der Nähe eines wütenden Sumatra-Vulkans gefunden wurden, könnten auf eine neue menschliche Migrationsroute hinweisen, und Beweise für frühe olympische Opferrituale werden enthüllt. Besuchen Sie ein prähistorisches geräuchertes Dorf …","Discovered By Disaster S01E09 1080p DSNP WEB-DL H264-Dooky. Season 1, Episode 09 – “Lost Treasures And Resilient Civilizations”Fish remains found near an angry Sumatran volcano could suggest a new human migration route, and evidence of early Olympic sacrificial rituals are revealed. Visit a prehistoric village smoked …","Inventum per malum S01E09 1080p DSNP WEB-DL H264-Dooky. Temporum 1, Episode 09 - ""Adesti thesauri et civilizationes molles"" Piscium reliquiae prope iratum Sumatran vulcanus inveniebant novam migrationis humanam viam suggerere, et argumenta rituum Olympicorum veterum revelata sunt. Visita villa prehistorica fumabat ...",2025-12-26 12:48:16+00:00
6b80c145aa33be3e03d06897ecb74e21,2025-12-22T04:42:37Z,'volcano',post.rlsbb.to,en,0.9,Discovered By Disaster S01E10 1080p DSNP WEB-DL H264-Dooky,"Season 1, Episode 10 – “Timeless Tombs And Modern Survivors”The team dig into artefacts from a multicultural Jamaican port sunk by a devastating earthquake. They get insights into everyday Mesoamerican life next to a Salvadoran volcano, peek at a Minoan landm…",https://post.rlsbb.to/discovered-by-disaster-s01e10-1080p-dsnp-web-dl-h264-dooky/,,,"Season 1, Episode 10 “Timeless Tombs And Modern Survivors”The team dig into artefacts from a multicultural Jamaican port sunk by a devastating earthquake. They get insights into everyday Mesoamerican… [+646 chars]",,"Entdeckt durch die Katastrophe S01E10 1080p DSNP WEB-DL H264-Dooky. Staffel 1, Folge 10 – „Zeitlose Gräber und moderne Überlebende“ Das Team untersucht Artefakte aus einem multikulturellen jamaikanischen Hafen, der durch ein verheerendes Erdbeben versunken ist. Sie erhalten Einblicke in das alltägliche mesoamerikanische Leben neben einem salvadorianischen Vulkan, werfen einen Blick auf einen minoischen Landstrich …","Discovered By Disaster S01E10 1080p DSNP WEB-DL H264-Dooky. Season 1, Episode 10 – “Timeless Tombs And Modern Survivors”The team dig into artefacts from a multicultural Jamaican port sunk by a devastating earthquake. They get insights into everyday Mesoamerican life next to a Salvadoran volcano, peek at a Minoan landm…","Inventum per malum S01E10 1080p DSNP WEB-DL H264-Dooky. Temporum 1, Episode 10 – “Sepulchra intempesta et moderni superviventes” Turma in artificiis foderunt a portu Jamaican multiculturali terrae motu vastante demersi. Perceptiones in vitam cotidianam Mesoamericanam iuxta a Vulcano Salvadorano, peek ad landm Minoam.",2025-12-26 12:48:16+00:00
175c36bacb821cd8b891e4cb94683538,2025-12-22T07:31:59Z,'volcano',economictimes.indiatimes.com,en,0.9,"Celebrate New Year with a cruise to India's only active volcano in Andaman; check ticket price, booking details and more","Welcome the New Year with a view of India's only active volcano. A special cruise to Barren Island departs on December 31. Passengers will witness the volcanic island during the year-end celebration. The voyage offers music, exotic food, and other activities.…",https://economictimes.indiatimes.com/news/india/celebrate-new-year-with-a-cruise-to-indias-only-active-volcano-in-andaman-check-ticket-price-booking-details-and-more/articleshow/126117349.cms,"https://img.etimg.com/thumb/msid-126117740,width-1200,height-630,imgsize-90800,overlay-economictimes/articleshow.jpg",,"Investment Ideas
Grow your wealth with stock ideas &amp; sectoral trends.
Stock Reports Plus
Buy low &amp; sell high with access to Stock Score, Upside potential &amp; more. 
BigBull Portfolio
G… [+439 chars]",,"Feiern Sie das neue Jahr mit einer Kreuzfahrt zum einzigen aktiven Vulkan Indiens in den Andamanen. Überprüfen Sie den Ticketpreis, die Buchungsdetails und mehr. Begrüßen Sie das neue Jahr mit einem Blick auf Indiens einzigen aktiven Vulkan. Am 31. Dezember startet eine Sonderkreuzfahrt zur Barren Island. Passagiere werden während der Feier zum Jahresende Zeuge der Vulkaninsel. Die Reise bietet Musik, exotisches Essen und andere Aktivitäten.…","Celebrate New Year with a cruise to India's only active volcano in Andaman; check ticket price, booking details and more. Welcome the New Year with a view of India's only active volcano. A special cruise to Barren Island departs on December 31. Passengers will witness the volcanic island during the year-end celebration. The voyage offers music, exotic food, and other activities.…","Celebrate New Year cum lecythus in India solum vulcano activo in Andaman; tesserae pretium reprehendo, libri singula et plura. Excipe Novus Annus cum intuitu tantum activae vulcani Indiae. Peculiaris lecythus in Barren Island recedit die 31 Decembris. Viatores testabitur insulam volcanicam in anno ad finem celebrationis. Navigatio musica, exotica cibum, et alias operationes praebet.",2025-12-26 12:48:16+00:00
2d96b40e1e16346f52c441144198651f,2025-12-22T21:38:00Z,'volcano',www.livescience.com,en,0.9,Best space photos of 2025,"An alien comet, a Martian volcano, a man’s fall from the sun and a groundbreaking telescope’s first images: Here are the most jaw-dropping space photos of 2025.",https://www.livescience.com/space/best-space-photos-of-2025,https://cdn.mos.cms.futurecdn.net/2B66Zq9YJKuTAYSmAXH8z6-1920-80.jpg,,"The final frontier is an unendingly beautiful expanse filled with unimaginable wonders, making it the perfect sandbox for photographers, astronomical observatories and space-based telescopes to captu… [+10696 chars]",,"Die besten Weltraumfotos des Jahres 2025. Ein außerirdischer Komet, ein Marsvulkan, der Sturz eines Menschen von der Sonne und die ersten Bilder eines bahnbrechenden Teleskops: Hier sind die atemberaubendsten Weltraumfotos des Jahres 2025.","Best space photos of 2025. An alien comet, a Martian volcano, a man’s fall from the sun and a groundbreaking telescope’s first images: Here are the most jaw-dropping space photos of 2025.","Spatium optimum photographemata 2025. Cometa peregrinus, a Martia vulcano, casus hominis e sole et telescopio contritionis primae imagines: Hic sunt maxime spatium maxillae distillationis photographicae 2025 .",2025-12-26 12:48:16+00:00
