index,published,keyword,domain,language,valid,title,description,url,image,archive,content,quote,de,en,la,added
135e6a742e03e70933817755c916bca0,2026-04-01T22:53:06Z,'lava volcano',bleedingcool.com,en,0.7,Liquid Hot Magma: Melon Sandbox Adds New Lava Maps In Latest Update,"Mobile developer and publisher PlayDucky has added the new highly-anticipated update to Melon Sandbox, as things get heated with two new lava levels. As you can see here, they have added a new Volcano map, as well as a Lava Pool, both of which have their own …",https://bleedingcool.com/games/liquid-hot-magma-melon-sandbox-adds-new-lava-maps-in-latest-update/,https://bleedingcool.com/wp-content/uploads/2026/04/MixCollage-01-Apr-2026-04-43-PM-7415-2000x1125.jpg,,"Posted in: Games, Mobile Games | Tagged: Melon Sandbox, PlayDucky
Melon Sandbox turns up the heat on players with an all-new update that adds two lava maps and new lava assets to the Sandbox system.… [+3341 chars]",,"Liquid Hot Magma: Melon Sandbox fügt im neuesten Update neue Lavakarten hinzu. Der mobile Entwickler und Herausgeber PlayDucky hat das mit Spannung erwartete neue Update zu Melon Sandbox hinzugefügt, da es mit zwei neuen Lava-Levels heiß hergeht. Wie Sie hier sehen können, haben sie eine neue Vulkankarte sowie einen Lavapool hinzugefügt, die beide über eine eigene …","Liquid Hot Magma: Melon Sandbox Adds New Lava Maps In Latest Update. Mobile developer and publisher PlayDucky has added the new highly-anticipated update to Melon Sandbox, as things get heated with two new lava levels. As you can see here, they have added a new Volcano map, as well as a Lava Pool, both of which have their own …","Liquid Hot Magma: Melon Sandbox Adds New Lava Maps in Tardus Update. Mobilis elit et publisher PlayDucky novam renovationem summe praeventus in Melon Sandbox adiecit, ut res cum duobus novis gradibus lavae calefiat. Ut hic videre potes, tabulam Volcano novam addiderunt, sicut etiam piscinam Lava, quorum utrumque suum habent…",2026-04-08 13:26:00+00:00
252fa9dc91c821eed49a2050f6ea9118,2026-04-07T13:00:54Z,'volcano',www.sciencealert.com,en,0.7,One of Earth's Most Explosive Volcanoes Is Quietly Refilling With Magma,"It unleashed the largest known eruption of the Holocene.ScienceAlert stories are written, fact-checked, and edited by humans, never generated by AI. Don't miss a story, subscribe here.",https://www.sciencealert.com/one-of-earths-most-explosive-volcanoes-is-quietly-refilling-with-magma,https://www.sciencealert.com/images/2026/04/20260327_press_seama-enthumb.jpg,,"About 7,300 years ago, a volcano off Japan's Kyushu island unleashed what remains the largest known eruption of the Holocene, our current geological epoch.
In a new study, researchers reveal how thi… [+4296 chars]",,"Einer der explosivsten Vulkane der Erde füllt sich leise mit Magma. Es löste den größten bekannten Ausbruch des Holozäns aus. ScienceAlert-Geschichten werden von Menschen geschrieben, auf Fakten überprüft und bearbeitet, niemals von KI generiert. Verpassen Sie keine Story und abonnieren Sie sie hier.","One of Earth's Most Explosive Volcanoes Is Quietly Refilling With Magma. It unleashed the largest known eruption of the Holocene.ScienceAlert stories are written, fact-checked, and edited by humans, never generated by AI. Don't miss a story, subscribe here.","Una Telluris explosivae vulcanorum quiete replens Magma. Maximam notam eruptionem Holocene invehit. Fabulae sciencealert scriptae sunt, fact-repressae, et ab hominibus editae, numquam ab AI generatae. Fabulam ne fallas, hic scribe.",2026-04-08 13:26:00+00:00
e0fcc07d044284cc74df6b283f896a6b,2026-04-02T04:01:00Z,'volcano',science.nasa.gov,en,0.9,Réunion Island Lava Reaches the Sea,The February 2026 eruption at Piton de la Fournaise has lasted longer and produced a larger volume of lava than recent eruptions from this frequently active volcano.,https://science.nasa.gov/earth/earth-observatory/reunion-island-lava-reaches-the-sea/,https://assets.science.nasa.gov/content/dam/science/esd/eo/images/iotd/2026/réunion-island-lava-reaches-the-sea/reunioneruption_oli2_20260328_th.jpg/jcr:content/renditions/cq5dam.web.1280.1280.jpeg,,"Located 700 kilometers (440 miles) east of Madagascar, Réunion Island is the product of a long-lived mantle hotspot on the floor of the Indian Ocean. The island first emerged above the oceans surface… [+3868 chars]",,Lava der Insel Réunion erreicht das Meer. Der Ausbruch am Piton de la Fournaise im Februar 2026 dauerte länger und produzierte eine größere Lavamenge als die jüngsten Ausbrüche dieses häufig aktiven Vulkans.,Réunion Island Lava Reaches the Sea. The February 2026 eruption at Piton de la Fournaise has lasted longer and produced a larger volume of lava than recent eruptions from this frequently active volcano.,Reunion Island Lava Mare attingit. Februarius 2026 eruptio apud Piton de la Fournaise diutius duravit et maius volumen lavae quam recentes eruptiones ex hoc vulcano saepe activo edidit.,2026-04-08 13:26:00+00:00
1bd00de6aabc24b68465d161eaf46cc4,2026-04-05T13:15:03Z,'volcano erupt',www.foxweather.com,en,0.9,Hawaii’s most active volcano Kilauea brewing as experts forecast 44th eruption in coming days,"According to the USGS, the forecast for the start of episode 44 is between April 6 to April 14.",https://www.foxweather.com/weather-news/hawaiis-most-active-volcano-brewing-yet-again-preparing-put-show-44th-time,https://nypost.com/wp-content/uploads/sites/2/2026/04/125055971.jpg?quality=75&strip=all&w=1200,,"Hawaii’s most active and popular volcano, Kilauea, is preparing to put on a show as geologists forecast the volcano’s 44th eruption in the coming days.
The United States Geological Survey said that … [+1856 chars]",,"Hawaiis aktivster Vulkan Kilauea braut sich zusammen, da Experten in den kommenden Tagen den 44. Ausbruch vorhersagen. Laut USGS ist der Start von Folge 44 voraussichtlich zwischen dem 6. und 14. April.","Hawaii’s most active volcano Kilauea brewing as experts forecast 44th eruption in coming days. According to the USGS, the forecast for the start of episode 44 is between April 6 to April 14.","Hawaii est acerrimus vulcano Kilauea medicandi ut periti praenuntiant 44 eruptionem in diebus venientibus. Secundum USGS, praesagio initium eventus 44 inter diem 6 Aprilis ad diem 14 Aprilis est.",2026-04-08 13:26:00+00:00
